{
  "schema": "vigilon.browser.event@1",
  "sdk": {
    "name": "@vigilon/browser",
    "version": "0.2.12"
  },
  "service": {
    "name": "corpus",
    "environment": "corpus",
    "version": "corpus-b"
  },
  "sentAt": "2026-01-01T00:00:00.000Z",
  "events": [
    {
      "type": "exception",
      "eventId": "466ab303-07fd-4740-aedb-9ce65453f005",
      "timestamp": "2026-01-01T00:00:00.000Z",
      "exception": {
        "type": "TypeError",
        "message": "Cannot read properties of null (reading 'email')",
        "stack": "TypeError: Cannot read properties of null (reading 'email')\n    at De (https://corpus.vigilon.test/assets/index-CgNAj55e.js:10:8570)\n    at https://corpus.vigilon.test/assets/index-CgNAj55e.js:10:14152",
        "mechanism": "onerror",
        "handled": false
      },
      "page": {
        "url": "https://corpus.vigilon.test/"
      },
      "session": {
        "id": "corpus-session"
      },
      "user": null,
      "traceId": null,
      "tags": {},
      "debugIds": {
        "https://corpus.vigilon.test/assets/index-CgNAj55e.js": "e95e7030-aa25-4c55-b740-0d0791ec7381"
      }
    }
  ]
}
