{
  "schema": "vigilon.browser.event@1",
  "sdk": {
    "name": "@vigilon/browser",
    "version": "0.2.12"
  },
  "service": {
    "name": "corpus",
    "environment": "corpus",
    "version": "corpus-b"
  },
  "sentAt": "2026-01-01T00:00:00.000Z",
  "events": [
    {
      "type": "exception",
      "eventId": "17693854-1b6e-41e6-98d2-0b5994860000",
      "timestamp": "2026-01-01T00:00:00.000Z",
      "exception": {
        "type": "TypeError",
        "message": "price-missing",
        "stack": "TypeError: price-missing\n    at H (https://corpus.vigilon.test/assets/index-CgNAj55e.js:10:8888)\n    at ze (https://corpus.vigilon.test/assets/index-CgNAj55e.js:10:8971)\n    at https://corpus.vigilon.test/assets/index-CgNAj55e.js:10:14152",
        "mechanism": "onerror",
        "handled": false
      },
      "page": {
        "url": "https://corpus.vigilon.test/"
      },
      "session": {
        "id": "corpus-session"
      },
      "user": null,
      "traceId": null,
      "tags": {},
      "debugIds": {
        "https://corpus.vigilon.test/assets/index-CgNAj55e.js": "e95e7030-aa25-4c55-b740-0d0791ec7381"
      }
    }
  ]
}
