{
  "schema": "vigilon.browser.event@1",
  "sdk": {
    "name": "@vigilon/browser",
    "version": "0.2.12"
  },
  "service": {
    "name": "corpus",
    "environment": "corpus",
    "version": "corpus-a"
  },
  "sentAt": "2026-01-01T00:00:00.000Z",
  "events": [
    {
      "type": "exception",
      "eventId": "e5603ab2-b881-43dd-aaa6-3b15105a9cb2",
      "timestamp": "2026-01-01T00:00:00.000Z",
      "exception": {
        "type": "TypeError",
        "message": "undefined is not an object (evaluating 'e.root.depth')",
        "stack": "Q@https://corpus.vigilon.test/assets/index-CBlyPtJs.js:10:12576\nQ@https://corpus.vigilon.test/assets/index-CBlyPtJs.js:10:12557\nQ@https://corpus.vigilon.test/assets/index-CBlyPtJs.js:10:12557",
        "mechanism": "onerror",
        "handled": false
      },
      "page": {
        "url": "https://corpus.vigilon.test/"
      },
      "session": {
        "id": "corpus-session"
      },
      "user": null,
      "traceId": null,
      "tags": {},
      "debugIds": {
        "https://corpus.vigilon.test/assets/index-CBlyPtJs.js": "c60127de-b1e2-48cf-becc-2588b5bb6070"
      }
    }
  ]
}
