{
  "schema": "vigilon.browser.event@1",
  "sdk": {
    "name": "@vigilon/browser",
    "version": "0.2.12"
  },
  "service": {
    "name": "corpus",
    "environment": "corpus",
    "version": "corpus-a"
  },
  "sentAt": "2026-01-01T00:00:00.000Z",
  "events": [
    {
      "type": "exception",
      "eventId": "fa3942b9-d07e-4e9b-84cf-93a2f94c8ab7",
      "timestamp": "2026-01-01T00:00:00.000Z",
      "exception": {
        "type": "TypeError",
        "message": "price-missing",
        "stack": "H@https://corpus.vigilon.test/assets/index-CBlyPtJs.js:10:8897\nZ@https://corpus.vigilon.test/assets/index-CBlyPtJs.js:10:12492",
        "mechanism": "onerror",
        "handled": false
      },
      "page": {
        "url": "https://corpus.vigilon.test/"
      },
      "session": {
        "id": "corpus-session"
      },
      "user": null,
      "traceId": null,
      "tags": {},
      "debugIds": {
        "https://corpus.vigilon.test/assets/index-CBlyPtJs.js": "c60127de-b1e2-48cf-becc-2588b5bb6070"
      }
    }
  ]
}
