{
  "schema": "vigilon.browser.event@1",
  "sdk": {
    "name": "@vigilon/browser",
    "version": "0.2.12"
  },
  "service": {
    "name": "corpus",
    "environment": "corpus",
    "version": "corpus-a"
  },
  "sentAt": "2026-01-01T00:00:00.000Z",
  "events": [
    {
      "type": "exception",
      "eventId": "ec73624a-8d3d-4610-8cbf-7274c29ad4db",
      "timestamp": "2026-01-01T00:00:00.000Z",
      "exception": {
        "type": "Error",
        "message": "statements-unavailable",
        "stack": "e@https://corpus.vigilon.test/assets/statements-D5iB4wI-.js:2:55",
        "mechanism": "unhandledrejection",
        "handled": false
      },
      "page": {
        "url": "https://corpus.vigilon.test/"
      },
      "session": {
        "id": "corpus-session"
      },
      "user": null,
      "traceId": null,
      "tags": {},
      "debugIds": {
        "https://corpus.vigilon.test/assets/statements-D5iB4wI-.js": "3b50b6ef-fead-4456-bd18-9abed6e77d41"
      }
    }
  ]
}
