{
  "schema": "vigilon.browser.event@1",
  "sdk": {
    "name": "@vigilon/browser",
    "version": "0.2.12"
  },
  "service": {
    "name": "corpus",
    "environment": "corpus",
    "version": "corpus-a"
  },
  "sentAt": "2026-01-01T00:00:00.000Z",
  "events": [
    {
      "type": "exception",
      "eventId": "f8ef333f-e672-4139-97da-ff9dbc740c9d",
      "timestamp": "2026-01-01T00:00:00.000Z",
      "exception": {
        "type": "Error",
        "message": "draft-title-missing",
        "stack": "Be@https://corpus.vigilon.test/assets/index-CBlyPtJs.js:10:9022\nU@https://corpus.vigilon.test/assets/index-CBlyPtJs.js:10:9092\nasync Ve@https://corpus.vigilon.test/assets/index-CBlyPtJs.js:10:9124",
        "mechanism": "unhandledrejection",
        "handled": false
      },
      "page": {
        "url": "https://corpus.vigilon.test/"
      },
      "session": {
        "id": "corpus-session"
      },
      "user": null,
      "traceId": null,
      "tags": {},
      "debugIds": {
        "https://corpus.vigilon.test/assets/index-CBlyPtJs.js": "c60127de-b1e2-48cf-becc-2588b5bb6070"
      }
    }
  ]
}
