{
  "schema": "vigilon.browser.event@1",
  "sdk": {
    "name": "@vigilon/browser",
    "version": "0.2.12"
  },
  "service": {
    "name": "corpus",
    "environment": "corpus",
    "version": "corpus-a"
  },
  "sentAt": "2026-01-01T00:00:00.000Z",
  "events": [
    {
      "type": "exception",
      "eventId": "b2773d4d-c461-49b7-9087-a7766653e881",
      "timestamp": "2026-01-01T00:00:00.000Z",
      "exception": {
        "type": "Error",
        "message": "statements-unavailable",
        "stack": "e@https://corpus.vigilon.test/assets/statements-D5iB4wI-.js:2:50\nasync*t@https://corpus.vigilon.test/assets/statements-D5iB4wI-.js:2:108\not/<@https://corpus.vigilon.test/assets/index-CBlyPtJs.js:10:12314\npromise callback*ot@https://corpus.vigilon.test/assets/index-CBlyPtJs.js:10:12290\n@https://corpus.vigilon.test/assets/index-CBlyPtJs.js:10:14152\nsetTimeout handler*@https://corpus.vigilon.test/assets/index-CBlyPtJs.js:10:14133\n",
        "mechanism": "unhandledrejection",
        "handled": false
      },
      "page": {
        "url": "https://corpus.vigilon.test/"
      },
      "session": {
        "id": "corpus-session"
      },
      "user": null,
      "traceId": null,
      "tags": {},
      "debugIds": {
        "https://corpus.vigilon.test/assets/index-CBlyPtJs.js": "c60127de-b1e2-48cf-becc-2588b5bb6070",
        "https://corpus.vigilon.test/assets/statements-D5iB4wI-.js": "3b50b6ef-fead-4456-bd18-9abed6e77d41"
      }
    }
  ]
}
