{
  "schema": "vigilon.browser.event@1",
  "sdk": {
    "name": "@vigilon/browser",
    "version": "0.2.12"
  },
  "service": {
    "name": "corpus",
    "environment": "corpus",
    "version": "corpus-a"
  },
  "sentAt": "2026-01-01T00:00:00.000Z",
  "events": [
    {
      "type": "exception",
      "eventId": "3d3d3c22-b429-4f3f-b833-e70ebfed9690",
      "timestamp": "2026-01-01T00:00:00.000Z",
      "exception": {
        "type": "TypeError",
        "message": "Cannot set properties of undefined (setting 'name')",
        "stack": "TypeError: Cannot set properties of undefined (setting 'name')\n    at Pe (https://corpus.vigilon.test/assets/index-CeR2v4rx.js:9:8769)\n    at https://corpus.vigilon.test/assets/index-CeR2v4rx.js:9:14152",
        "mechanism": "onerror",
        "handled": false
      },
      "page": {
        "url": "https://corpus.vigilon.test/"
      },
      "session": {
        "id": "corpus-session"
      },
      "user": null,
      "traceId": null,
      "tags": {}
    }
  ]
}
