{
  "schema": "vigilon.browser.event@1",
  "sdk": {
    "name": "@vigilon/browser",
    "version": "0.2.12"
  },
  "service": {
    "name": "corpus",
    "environment": "corpus",
    "version": "corpus-a"
  },
  "sentAt": "2026-01-01T00:00:00.000Z",
  "events": [
    {
      "type": "exception",
      "eventId": "d4bb6af0-e253-4a5f-b135-3075814f9eab",
      "timestamp": "2026-01-01T00:00:00.000Z",
      "exception": {
        "type": "TypeError",
        "message": "can't access property \"id\", e is undefined",
        "stack": "V@https://corpus.vigilon.test/assets/index-CeR2v4rx.js:9:8585\n@https://corpus.vigilon.test/assets/index-CeR2v4rx.js:9:14152\nsetTimeout handler*@https://corpus.vigilon.test/assets/index-CeR2v4rx.js:9:14133\n",
        "mechanism": "onerror",
        "handled": false
      },
      "page": {
        "url": "https://corpus.vigilon.test/"
      },
      "session": {
        "id": "corpus-session"
      },
      "user": null,
      "traceId": null,
      "tags": {}
    }
  ]
}
