{
  "schema": "vigilon.browser.event@1",
  "sdk": {
    "name": "@vigilon/browser",
    "version": "0.2.12"
  },
  "service": {
    "name": "corpus",
    "environment": "corpus",
    "version": "corpus-a"
  },
  "sentAt": "2026-01-01T00:00:00.000Z",
  "events": [
    {
      "type": "exception",
      "eventId": "fe18dd1e-d8b3-4573-9dde-bc7f07e0d69e",
      "timestamp": "2026-01-01T00:00:00.000Z",
      "exception": {
        "type": "Error",
        "message": "statements-unavailable",
        "stack": "e@https://corpus.vigilon.test/assets/statements-CkPRySQD.js:1:55",
        "mechanism": "unhandledrejection",
        "handled": false
      },
      "page": {
        "url": "https://corpus.vigilon.test/"
      },
      "session": {
        "id": "corpus-session"
      },
      "user": null,
      "traceId": null,
      "tags": {}
    }
  ]
}
